{
  "$schema": "https://json-schema.org/draft/2020-12/schema",
  "$id": "https://immersive-reader.local/contracts/v1/source.schema.json",
  "title": "Immutable book source",
  "type": "object",
  "additionalProperties": false,
  "required": [
    "schema_version",
    "book_id",
    "revision",
    "title",
    "language",
    "source",
    "paragraphs"
  ],
  "properties": {
    "schema_version": {
      "const": 1
    },
    "book_id": {
      "$ref": "#/$defs/bookId"
    },
    "revision": {
      "type": "integer",
      "minimum": 1
    },
    "title": {
      "type": "string",
      "minLength": 1
    },
    "language": {
      "type": "string",
      "pattern": "^[A-Za-z]{2,3}(?:-[A-Za-z0-9]{2,8})*$"
    },
    "authors": {
      "type": "array",
      "minItems": 1,
      "uniqueItems": true,
      "items": {
        "type": "string",
        "minLength": 1
      }
    },
    "source": {
      "type": "object",
      "additionalProperties": false,
      "required": ["format", "path", "sha256"],
      "properties": {
        "format": {
          "enum": ["txt", "epub"]
        },
        "path": {
          "$ref": "#/$defs/relativePath"
        },
        "sha256": {
          "$ref": "#/$defs/sha256"
        },
        "encoding": {
          "enum": [
            "utf-8",
            "utf-8-sig",
            "utf-16-le",
            "utf-16-be",
            "utf-32-le",
            "utf-32-be",
            "gb18030"
          ]
        }
      },
      "allOf": [
        {
          "if": {
            "properties": {
              "format": { "const": "txt" }
            },
            "required": ["format"]
          },
          "then": {
            "required": ["encoding"]
          },
          "else": {
            "not": {
              "required": ["encoding"]
            }
          }
        }
      ]
    },
    "paragraphs": {
      "type": "array",
      "minItems": 1,
      "items": {
        "$ref": "#/$defs/paragraph"
      }
    },
    "illustrations": {
      "type": "array",
      "minItems": 1,
      "items": {
        "$ref": "#/$defs/illustration"
      }
    }
  },
  "$defs": {
    "bookId": {
      "type": "string",
      "pattern": "^[a-z0-9]+(?:-[a-z0-9]+)*$"
    },
    "paragraphId": {
      "type": "string",
      "pattern": "^p[0-9]{4,}$"
    },
    "relativePath": {
      "type": "string",
      "minLength": 1,
      "pattern": "^(?!/)(?!.*(?:^|/)\\.\\.(?:/|$)).+"
    },
    "sha256": {
      "type": "string",
      "pattern": "^[a-f0-9]{64}$"
    },
    "paragraph": {
      "type": "object",
      "additionalProperties": false,
      "required": ["id", "kind", "text"],
      "properties": {
        "id": {
          "$ref": "#/$defs/paragraphId"
        },
        "kind": {
          "enum": ["title", "chapter_heading", "prose", "epigraph"]
        },
        "text": {
          "type": "string",
          "minLength": 1
        }
      }
    },
    "illustration": {
      "type": "object",
      "additionalProperties": false,
      "required": [
        "id",
        "at",
        "title",
        "path",
        "media_type",
        "sha256",
        "source_href"
      ],
      "properties": {
        "id": {
          "type": "string",
          "pattern": "^ill[0-9]{4,}$"
        },
        "at": {
          "$ref": "#/$defs/paragraphId"
        },
        "title": {
          "type": "string",
          "minLength": 1
        },
        "path": {
          "$ref": "#/$defs/relativePath"
        },
        "media_type": {
          "enum": ["image/jpeg", "image/png", "image/gif", "image/webp"]
        },
        "sha256": {
          "$ref": "#/$defs/sha256"
        },
        "source_href": {
          "$ref": "#/$defs/relativePath"
        }
      }
    }
  }
}
