{
  "schema_version": 1,
  "book_id": "fixture-book",
  "revision": 1,
  "title": "测试之书",
  "language": "zh-CN",
  "source": {
    "format": "txt",
    "path": "source.txt",
    "sha256": "3978aa0746fa60df7511af9781d665fbf2411a341ce383d7e79d2933c6c70b21",
    "encoding": "utf-8"
  },
  "paragraphs": [
    {
      "id": "p0001",
      "kind": "title",
      "text": "测试之书"
    },
    {
      "id": "p0002",
      "kind": "prose",
      "text": "雨开始下了。"
    },
    {
      "id": "p0003",
      "kind": "prose",
      "text": "他没有带伞。"
    },
    {
      "id": "p0004",
      "kind": "prose",
      "text": "远处的灯亮了。"
    }
  ]
}
